{
  "archive_url": null,
  "checksum": "sha256:c5954f5e55943b93dd309061c2d6174a1b5d62a324e7be0873b95587a066c8f9",
  "country_codes": [
    "AE",
    "BH",
    "DJ",
    "DZ",
    "EG",
    "IQ",
    "JO",
    "KM",
    "KW",
    "LB",
    "LY",
    "MA",
    "MR",
    "OM",
    "PS",
    "QA",
    "SA",
    "SD",
    "SO",
    "SY",
    "TN",
    "YE"
  ],
  "id": "SRC-ARAB-FINAL-AUDIT-2026",
  "language": "ar",
  "license": "Repository license not declared; internal project audit use",
  "locator": "Complete report; especially the baseline, country assessments, defects, and exit gates",
  "notes": "Authoritative for migration decisions, not an official geographic authority.",
  "publication_date": "2026-08-15",
  "publisher": "Arab project repository",
  "retrieved_at": "2026-08-15",
  "schema_version": "1.0.0",
  "source_type": "project_audit",
  "title": "FINAL_AUDIT — accepted project baseline",
  "url": "https://github.com/hishamalmushrea-cloud/arab/blob/arena/01a00307-arab/audit/FINAL_AUDIT.md"
}
